{
  "id": "standard",
  "base_profile": "standard",
  "controls": {
    "authority": {
      "trust_anchors_required": false,
      "allow_untrusted": true
    },
    "freshness": {
      "max_age_seconds": 3600,
      "require_live": false,
      "stale_disposition": "defer"
    },
    "revocation": {
      "mode": "delta",
      "hard_fail": false,
      "max_age_seconds": 3600,
      "enforcement": "warn",
      "delta_channel_required": false
    },
    "failure": {
      "network_failure": "fail_open",
      "policy_unavailable": "fail_open"
    },
    "evidence": {
      "emit_audit_bundle": true,
      "require_attestation": false,
      "require_feed_descriptors": false
    },
    "descriptor_policy": {
      "policy": "observe",
      "revocation": "observe",
      "snapshot": "observe",
      "gateway_route": "observe"
    },
    "transport": {
      "mode": "http",
      "integrity": "tls",
      "availability_requirement": "best_effort"
    },
    "determinism": {
      "replayable": true,
      "require_pinned_feeds": false
    },
    "decision": {
      "degraded_disposition": "degraded"
    }
  },
  "overlays": [],
  "source": "profiles/standard.json"
}
